{
  "posts": [
    {
      "title": "Update 2/12/2016",
      "post_name": "update-6",
      "post_date": "2016-02-12 09:25:50",
      "status": "publish",
      "excerpt": null,
      "categories": [
        "Update Blog"
      ]
    },
    {
      "title": "Update 1/15/2016",
      "post_name": "update-7",
      "post_date": "2016-01-15 09:26:28",
      "status": "publish",
      "excerpt": null,
      "categories": [
        "Update Blog"
      ]
    },
    {
      "title": "Update 12/10/2015",
      "post_name": "update-8",
      "post_date": "2015-12-10 09:26:57",
      "status": "publish",
      "excerpt": null,
      "categories": [
        "Update Blog"
      ]
    },
    {
      "title": "Update 11/11/2015",
      "post_name": "update-9",
      "post_date": "2015-11-11 09:27:29",
      "status": "publish",
      "excerpt": null,
      "categories": [
        "Update Blog"
      ]
    },
    {
      "title": "Welcome to the new HandyWorks website!",
      "post_name": "hello-world",
      "post_date": "2017-02-12 14:19:57",
      "status": "publish",
      "excerpt": null,
      "categories": [
        "Update Blog"
      ]
    },
    {
      "title": "Update 12/9/2016",
      "post_name": "update",
      "post_date": "2016-12-09 09:18:42",
      "status": "publish",
      "excerpt": null,
      "categories": [
        "Update Blog"
      ]
    },
    {
      "title": "Update 9/12/2016",
      "post_name": "update-2",
      "post_date": "2016-09-12 09:22:29",
      "status": "publish",
      "excerpt": null,
      "categories": [
        "Update Blog"
      ]
    },
    {
      "title": "Update 7/1/2016",
      "post_name": "update-3",
      "post_date": "2016-07-01 09:23:20",
      "status": "publish",
      "excerpt": null,
      "categories": [
        "Update Blog"
      ]
    },
    {
      "title": "Update 5/16/2016",
      "post_name": "update-4",
      "post_date": "2016-05-16 09:24:53",
      "status": "publish",
      "excerpt": null,
      "categories": [
        "Update Blog"
      ]
    },
    {
      "title": "Update 4/19/2016",
      "post_name": "update-5",
      "post_date": "2016-04-19 09:25:21",
      "status": "publish",
      "excerpt": null,
      "categories": [
        "Update Blog"
      ]
    },
    {
      "title": "Multi-clinic electronic billing 1/27/2017",
      "post_name": "multi-clinic-electronic-billing-1272017",
      "post_date": "2017-01-27 13:44:28",
      "status": "publish",
      "excerpt": null,
      "categories": [
        "Update Blog"
      ]
    },
    {
      "title": "New streamlined website 1/27/2017",
      "post_name": "new-streamlined-website-1272017",
      "post_date": "2017-01-27 14:03:46",
      "status": "publish",
      "excerpt": null,
      "categories": [
        "Update Blog"
      ]
    },
    {
      "title": "2/13/2017 Update",
      "post_name": "2132017-update",
      "post_date": "2017-02-13 19:07:11",
      "status": "publish",
      "excerpt": null,
      "categories": [
        "Update Blog"
      ]
    },
    {
      "title": "Who Owes?",
      "post_name": "who-owes",
      "post_date": "2017-02-15 18:21:22",
      "status": "publish",
      "excerpt": null,
      "categories": [
        "Support"
      ]
    },
    {
      "title": "My transaction screen doesn't show case totals.",
      "post_name": "feel-free-to-comment-on-any-post",
      "post_date": "2017-02-16 17:13:20",
      "status": "publish",
      "excerpt": null,
      "categories": [
        "Update Blog"
      ]
    },
    {
      "title": "Unpaid Bills revisited",
      "post_name": "unpaid-bills-revisited",
      "post_date": "2017-02-22 19:37:39",
      "status": "publish",
      "excerpt": null,
      "categories": [
        "Update Blog"
      ]
    },
    {
      "title": "Inspired by the Ocars...",
      "post_name": "inspired-by-the-ocars",
      "post_date": "2017-02-28 13:06:02",
      "status": "publish",
      "excerpt": null,
      "categories": [
        "Update Blog"
      ]
    },
    {
      "title": "How can I remove all my old (inactive) patients at once?",
      "post_name": "how-can-i-remove-all-my-old-inactive-patients-at-once",
      "post_date": "2017-03-01 14:51:47",
      "status": "publish",
      "excerpt": null,
      "categories": [
        "Update Blog"
      ]
    },
    {
      "title": "Electronic Remittance (835) Fix",
      "post_name": "electronic-remittance-835-fix",
      "post_date": "2017-03-09 13:15:39",
      "status": "publish",
      "excerpt": null,
      "categories": [
        "Update Blog"
      ]
    },
    {
      "title": "New Statistics module",
      "post_name": "new-statistics-module",
      "post_date": "2017-04-01 20:22:06",
      "status": "publish",
      "excerpt": null,
      "categories": [
        "Update Blog"
      ]
    },
    {
      "title": "Statistical analysis",
      "post_name": "statistical-analysis",
      "post_date": "2017-04-20 15:27:36",
      "status": "publish",
      "excerpt": null,
      "categories": [
        "Update Blog"
      ]
    },
    {
      "title": "How to fix duplicate patients, plus more",
      "post_name": "how-to-fix-duplicate-patients-plus-more",
      "post_date": "2017-05-18 03:50:57",
      "status": "publish",
      "excerpt": null,
      "categories": [
        "Update Blog"
      ]
    },
    {
      "title": "Duplicates merge perfected. Plus more.",
      "post_name": "a-few-minor-fixes-that-are-coming-soon",
      "post_date": "2017-06-27 20:01:20",
      "status": "publish",
      "excerpt": null,
      "categories": [
        "Update Blog"
      ]
    },
    {
      "title": "Database repair option",
      "post_name": "database-repair-option",
      "post_date": "2017-08-08 16:07:11",
      "status": "publish",
      "excerpt": null,
      "categories": [
        "Update Blog"
      ]
    },
    {
      "title": "Scrollbar issue in Office 365",
      "post_name": "scrollbar-issue-in-office-365",
      "post_date": "2017-08-24 17:02:22",
      "status": "publish",
      "excerpt": null,
      "categories": [
        "Update Blog"
      ]
    },
    {
      "title": "Margin Settings Upgrade",
      "post_name": "margin-settings-upgrade",
      "post_date": "2017-08-31 13:07:15",
      "status": "publish",
      "excerpt": null,
      "categories": [
        "Update Blog"
      ]
    },
    {
      "title": "Medicare date format changes to two digit years",
      "post_name": "medicare-date-formats",
      "post_date": "2017-09-19 14:19:31",
      "status": "publish",
      "excerpt": null,
      "categories": [
        "Update Blog"
      ]
    },
    {
      "title": "Cleanup version",
      "post_name": "cleanup-version",
      "post_date": "2017-11-03 17:27:49",
      "status": "publish",
      "excerpt": null,
      "categories": [
        "Update Blog"
      ]
    },
    {
      "title": "Patient Data Print-Screen, New POS",
      "post_name": "patient-data-printscreen",
      "post_date": "2017-11-08 16:22:55",
      "status": "publish",
      "excerpt": null,
      "categories": [
        "Update Blog"
      ]
    },
    {
      "title": "Upgrade Nag, Letters Fix",
      "post_name": "upgrade-nag",
      "post_date": "2018-01-12 16:06:32",
      "status": "publish",
      "excerpt": null,
      "categories": [
        "Update Blog"
      ]
    },
    {
      "title": "Remember When?",
      "post_name": "remember-when",
      "post_date": "2018-01-18 15:07:12",
      "status": "publish",
      "excerpt": null,
      "categories": [
        "Update Blog"
      ]
    },
    {
      "title": "Inventory Control",
      "post_name": "inventory-control",
      "post_date": "2018-02-13 18:18:52",
      "status": "publish",
      "excerpt": null,
      "categories": [
        "Update Blog"
      ]
    },
    {
      "title": "April Update",
      "post_name": "up-and-coming",
      "post_date": "2018-04-05 21:00:29",
      "status": "publish",
      "excerpt": null,
      "categories": [
        "Update Blog"
      ]
    },
    {
      "title": "Goodbye 800#",
      "post_name": "goodbye-800",
      "post_date": "2018-04-23 13:57:06",
      "status": "publish",
      "excerpt": null,
      "categories": [
        "Update Blog"
      ]
    },
    {
      "title": "Screen Resizing",
      "post_name": "screen-resizing",
      "post_date": "2018-05-07 18:28:40",
      "status": "publish",
      "excerpt": null,
      "categories": [
        "Update Blog"
      ]
    },
    {
      "title": "Enhanced Connectivity Tests",
      "post_name": "enhanced-connectivity-tests",
      "post_date": "2018-07-31 19:06:58",
      "status": "publish",
      "excerpt": null,
      "categories": [
        "Update Blog"
      ]
    },
    {
      "title": "Transform multiple carriers and procedure codes",
      "post_name": "merging-multiple-carriers",
      "post_date": "2018-08-15 17:12:16",
      "status": "publish",
      "excerpt": null,
      "categories": [
        "Update Blog"
      ]
    },
    {
      "title": "Adding 98943 to the exam form",
      "post_name": "adding-98943",
      "post_date": "2018-10-10 14:47:40",
      "status": "publish",
      "excerpt": null,
      "categories": [
        "Update Blog"
      ]
    },
    {
      "title": "New for 2019",
      "post_name": "new-for-2019",
      "post_date": "2019-01-22 20:01:33",
      "status": "publish",
      "excerpt": null,
      "categories": [
        "Update Blog"
      ]
    },
    {
      "title": "That's Been Fixed!",
      "post_name": "thats-been-fixed",
      "post_date": "2019-02-06 18:30:32",
      "status": "publish",
      "excerpt": null,
      "categories": [
        "Update Blog"
      ]
    },
    {
      "title": "NY Workers Comp",
      "post_name": "ny-workers-comp",
      "post_date": "2019-02-22 14:11:51",
      "status": "publish",
      "excerpt": null,
      "categories": [
        "Update Blog"
      ]
    },
    {
      "title": "New Add-In menu",
      "post_name": "new-add-in-menu",
      "post_date": "2019-04-17 13:59:42",
      "status": "publish",
      "excerpt": null,
      "categories": [
        "Update Blog"
      ]
    },
    {
      "title": "Improved Receipt and New Credit Card Processor",
      "post_name": "new-credit-card-processor",
      "post_date": "2019-08-09 16:21:16",
      "status": "publish",
      "excerpt": null,
      "categories": [
        "Update Blog"
      ]
    },
    {
      "title": "Support for multiple databases",
      "post_name": "support-for-multiple-databases",
      "post_date": "2019-11-06 13:40:44",
      "status": "publish",
      "excerpt": null,
      "categories": [
        "Update Blog"
      ]
    },
    {
      "title": "2020 Add-In menu, ordering physician",
      "post_name": "2020-add-in-menu-ordering-physician",
      "post_date": "2020-01-28 19:11:25",
      "status": "publish",
      "excerpt": null,
      "categories": [
        "Update Blog"
      ]
    },
    {
      "title": "A Raw Data Checkup",
      "post_name": "a-raw-data-checkup",
      "post_date": "2020-07-10 16:12:48",
      "status": "publish",
      "excerpt": null,
      "categories": [
        "Update Blog"
      ]
    },
    {
      "title": "Update to Added Appointments",
      "post_name": "update-to-added-appointments",
      "post_date": "2020-09-21 13:33:07",
      "status": "publish",
      "excerpt": null,
      "categories": [
        "Update Blog"
      ]
    },
    {
      "title": "Multiple Appointment Fix",
      "post_name": "multiple-appointment-fix",
      "post_date": "2020-10-12 16:57:13",
      "status": "publish",
      "excerpt": null,
      "categories": [
        "Update Blog"
      ]
    },
    {
      "title": "2021 Welcome Update",
      "post_name": "2021-welcome-update",
      "post_date": "2021-01-20 19:27:36",
      "status": "publish",
      "excerpt": null,
      "categories": [
        "Update Blog"
      ]
    },
    {
      "title": "2021 Midyear update",
      "post_name": "2021-midyear-update",
      "post_date": "2021-07-28 13:06:41",
      "status": "publish",
      "excerpt": null,
      "categories": [
        "Update Blog"
      ]
    },
    {
      "title": "Tax Rate Fix",
      "post_name": "tax-rate-fix",
      "post_date": "2022-02-11 18:27:46",
      "status": "publish",
      "excerpt": null,
      "categories": [
        "Update Blog"
      ]
    },
    {
      "title": "A new Report and Appointment Book fixes",
      "post_name": "a-new-report-and-appointment-book-fixes",
      "post_date": "2022-03-29 12:44:55",
      "status": "publish",
      "excerpt": null,
      "categories": [
        "Update Blog"
      ]
    },
    {
      "title": "Minor improvements Summer 2022",
      "post_name": "minor-improvements-summer-2022",
      "post_date": "2022-07-01 18:53:51",
      "status": "publish",
      "excerpt": null,
      "categories": [
        "Update Blog"
      ]
    },
    {
      "title": "A longer Payer ID - Fall 2022 update",
      "post_name": "a-longer-payer-id",
      "post_date": "2022-10-07 14:37:45",
      "status": "publish",
      "excerpt": null,
      "categories": [
        "Update Blog"
      ]
    },
    {
      "title": "Month at a glance - Jan 2023",
      "post_name": "month-at-a-glance-jan-2023",
      "post_date": "2023-01-24 16:00:20",
      "status": "publish",
      "excerpt": null,
      "categories": [
        "Update Blog"
      ]
    },
    {
      "title": "Faster & Faster",
      "post_name": "faster-faster",
      "post_date": "2023-03-14 15:02:56",
      "status": "publish",
      "excerpt": null,
      "categories": [
        "Update Blog"
      ]
    },
    {
      "title": "Small Electronic Billing Edits",
      "post_name": "small-electronic-billing-edits",
      "post_date": "2023-07-26 17:00:49",
      "status": "publish",
      "excerpt": null,
      "categories": [
        "Update Blog"
      ]
    },
    {
      "title": "Corrected Claims",
      "post_name": "corrected-claims",
      "post_date": "2023-11-16 19:50:02",
      "status": "publish",
      "excerpt": null,
      "categories": [
        "Update Blog"
      ]
    },
    {
      "title": "Enhanced Daily Appointment Reports",
      "post_name": "enhanced-daily-appointment-reports",
      "post_date": "2024-02-13 17:36:55",
      "status": "publish",
      "excerpt": null,
      "categories": [
        "Update Blog"
      ]
    },
    {
      "title": "Integrated Text Messaging",
      "post_name": "integrated-text-messaging",
      "post_date": "2024-08-08 17:57:41",
      "status": "publish",
      "excerpt": null,
      "categories": [
        "Update Blog"
      ]
    },
    {
      "title": "New and Fixed in February 2025",
      "post_name": "new-and-fixed-in-february-2025",
      "post_date": "2025-02-26 18:57:15",
      "status": "publish",
      "excerpt": null,
      "categories": [
        "Update Blog"
      ]
    }
  ],
  "pages": [
    {
      "title": "FAQ",
      "post_name": "faq",
      "post_date": "2017-01-19 19:03:39",
      "status": "publish",
      "excerpt": null,
      "categories": []
    },
    {
      "title": "The HandyWorks Story",
      "post_name": "the-handyworks-story",
      "post_date": "2017-01-19 19:04:04",
      "status": "publish",
      "excerpt": null,
      "categories": []
    },
    {
      "title": "Features",
      "post_name": "features",
      "post_date": "2017-01-19 19:05:33",
      "status": "publish",
      "excerpt": null,
      "categories": []
    },
    {
      "title": "Reports List",
      "post_name": "reports-list",
      "post_date": "2017-01-19 19:07:45",
      "status": "publish",
      "excerpt": null,
      "categories": []
    },
    {
      "title": "Contact Us",
      "post_name": "feedback",
      "post_date": "2017-01-19 19:08:06",
      "status": "publish",
      "excerpt": null,
      "categories": []
    },
    {
      "title": "Upgrades & Downloads",
      "post_name": "download",
      "post_date": "2017-01-19 19:08:29",
      "status": "publish",
      "excerpt": null,
      "categories": []
    },
    {
      "title": "About Us",
      "post_name": "new-users",
      "post_date": "2017-01-25 12:09:30",
      "status": "publish",
      "excerpt": null,
      "categories": []
    },
    {
      "title": "Partners",
      "post_name": "partners",
      "post_date": "2017-02-20 11:47:33",
      "status": "publish",
      "excerpt": null,
      "categories": []
    },
    {
      "title": "Shop",
      "post_name": "shop",
      "post_date": "2017-03-02 13:07:09",
      "status": "publish",
      "excerpt": null,
      "categories": []
    },
    {
      "title": "Checkout",
      "post_name": "checkout",
      "post_date": "2017-03-02 13:07:09",
      "status": "publish",
      "excerpt": null,
      "categories": []
    },
    {
      "title": "My Account",
      "post_name": "my-account",
      "post_date": "2017-03-02 13:07:09",
      "status": "publish",
      "excerpt": null,
      "categories": []
    },
    {
      "title": "We Value your privacy",
      "post_name": "we-value-your-privacy",
      "post_date": "2018-12-02 11:28:05",
      "status": "publish",
      "excerpt": null,
      "categories": []
    },
    {
      "title": "How to Install HW on a new computer.",
      "post_name": "how-to-install-hw-on-a-new-computer",
      "post_date": "2022-04-28 18:00:07",
      "status": "publish",
      "excerpt": null,
      "categories": []
    },
    {
      "title": null,
      "post_name": null,
      "post_date": "2022-10-07 16:50:52",
      "status": "draft",
      "excerpt": null,
      "categories": []
    },
    {
      "title": "Month At a Glance",
      "post_name": "month-at-a-glance",
      "post_date": "2023-01-24 15:18:01",
      "status": "publish",
      "excerpt": null,
      "categories": []
    }
  ],
  "media": [
    {
      "title": "CIP_jpg",
      "post_name": "cip_jpg",
      "attachment_url": "https://www.handyworks.com/wp-content/uploads/2017/02/CIP_jpg.jpg",
      "post_date": "2017-02-12 23:54:35"
    },
    {
      "title": "cropped-sbs1.jpg",
      "post_name": "cropped-sbs1-jpg",
      "attachment_url": "https://www.handyworks.com/wp-content/uploads/2017/02/cropped-sbs1.jpg",
      "post_date": "2017-02-13 00:30:38"
    },
    {
      "title": "hwlogo",
      "post_name": "hwlogo",
      "attachment_url": "https://www.handyworks.com/wp-content/uploads/2017/02/hwlogo.gif",
      "post_date": "2017-02-13 00:32:12"
    },
    {
      "title": "cropped-hwlogo.gif",
      "post_name": "cropped-hwlogo-gif",
      "attachment_url": "https://www.handyworks.com/wp-content/uploads/2017/02/cropped-hwlogo.gif",
      "post_date": "2017-02-13 00:32:30"
    },
    {
      "title": "jasontaylor_79_0",
      "post_name": "jasontaylor_79_0",
      "attachment_url": "https://www.handyworks.com/wp-content/uploads/2017/02/jasontaylor_79_0.jpg",
      "post_date": "2017-02-13 04:33:26"
    },
    {
      "title": "jasontaylor_68_0",
      "post_name": "jasontaylor_68_0",
      "attachment_url": "https://www.handyworks.com/wp-content/uploads/2017/02/jasontaylor_68_0.jpg",
      "post_date": "2017-02-13 04:33:27"
    },
    {
      "title": "jasontaylor_56_0",
      "post_name": "jasontaylor_56_0",
      "attachment_url": "https://www.handyworks.com/wp-content/uploads/2017/02/jasontaylor_56_0.jpg",
      "post_date": "2017-02-13 04:33:28"
    },
    {
      "title": "jasontaylor_52_0",
      "post_name": "jasontaylor_52_0",
      "attachment_url": "https://www.handyworks.com/wp-content/uploads/2017/02/jasontaylor_52_0.jpg",
      "post_date": "2017-02-13 04:33:29"
    },
    {
      "title": "Unpaid Bills",
      "post_name": "image-2",
      "attachment_url": "https://www.handyworks.com/wp-content/uploads/2017/02/image-2.png",
      "post_date": "2017-02-22 19:36:10"
    },
    {
      "title": "Capture",
      "post_name": "capture",
      "attachment_url": "https://www.handyworks.com/wp-content/uploads/2017/02/Capture.png",
      "post_date": "2017-02-22 20:34:12"
    },
    {
      "title": "oscar",
      "post_name": "oscar",
      "attachment_url": "https://www.handyworks.com/wp-content/uploads/2017/02/oscar.jpg",
      "post_date": "2017-02-28 13:04:46"
    },
    {
      "title": "Capture",
      "post_name": "capture-2",
      "attachment_url": "https://www.handyworks.com/wp-content/uploads/2017/03/Capture.png",
      "post_date": "2017-03-01 14:47:48"
    },
    {
      "title": "hands1",
      "post_name": "hands1-2",
      "attachment_url": "https://www.handyworks.com/wp-content/uploads/2017/01/hands1.jpg",
      "post_date": "2017-03-01 22:08:07"
    },
    {
      "title": "Capture",
      "post_name": "capture-3",
      "attachment_url": "https://www.handyworks.com/wp-content/uploads/2017/03/Capture-1.png",
      "post_date": "2017-03-02 23:10:22"
    },
    {
      "title": "Capture",
      "post_name": "capture-4",
      "attachment_url": "https://www.handyworks.com/wp-content/uploads/2017/03/Capture-2.png",
      "post_date": "2017-03-09 13:15:13"
    },
    {
      "title": "Stats",
      "post_name": "stats",
      "attachment_url": "https://www.handyworks.com/wp-content/uploads/2017/04/Stats.png",
      "post_date": "2017-04-04 21:06:27"
    },
    {
      "title": "statsform",
      "post_name": "statsform",
      "attachment_url": "https://www.handyworks.com/wp-content/uploads/2017/04/statsform.png",
      "post_date": "2017-04-20 15:25:39"
    },
    {
      "title": "Merge",
      "post_name": "merge",
      "attachment_url": "https://www.handyworks.com/wp-content/uploads/2017/06/Merge.png",
      "post_date": "2017-06-15 15:47:05"
    },
    {
      "title": "IMG_1153",
      "post_name": "img_1153",
      "attachment_url": "https://www.handyworks.com/wp-content/uploads/2017/06/IMG_1153.jpg",
      "post_date": "2017-06-27 20:00:38"
    },
    {
      "title": "enhanced-buzz-orig-28504-1364331827-9",
      "post_name": "enhanced-buzz-orig-28504-1364331827-9",
      "attachment_url": "https://www.handyworks.com/wp-content/uploads/2017/08/enhanced-buzz-orig-28504-1364331827-9.jpg",
      "post_date": "2017-08-08 11:20:03"
    },
    {
      "title": "Jack2",
      "post_name": "jack2-2",
      "attachment_url": "https://www.handyworks.com/wp-content/uploads/2017/08/Jack2.jpg",
      "post_date": "2017-08-08 17:06:58"
    },
    {
      "title": "Jack1",
      "post_name": "jack1",
      "attachment_url": "https://www.handyworks.com/wp-content/uploads/2017/08/Jack1.jpg",
      "post_date": "2017-08-08 17:07:17"
    },
    {
      "title": "repair",
      "post_name": "repair",
      "attachment_url": "https://www.handyworks.com/wp-content/uploads/2017/08/repair.png",
      "post_date": "2017-08-21 20:04:11"
    },
    {
      "title": "MarginSettings",
      "post_name": "marginsettings",
      "attachment_url": "https://www.handyworks.com/wp-content/uploads/2017/08/MarginSettings.png",
      "post_date": "2017-08-31 13:00:35"
    },
    {
      "title": "medicare-logo",
      "post_name": "medicare-logo",
      "attachment_url": "https://www.handyworks.com/wp-content/uploads/2017/09/medicare-logo.jpg",
      "post_date": "2017-09-19 14:19:41"
    },
    {
      "title": "swimmer",
      "post_name": "swimmer",
      "attachment_url": "https://www.handyworks.com/wp-content/uploads/2017/09/swimmer.jpeg",
      "post_date": "2017-09-27 13:17:18"
    },
    {
      "title": "coral",
      "post_name": "coral",
      "attachment_url": "https://www.handyworks.com/wp-content/uploads/2017/11/coral.jpg",
      "post_date": "2017-11-03 17:29:40"
    },
    {
      "title": "PrintScreen",
      "post_name": "printscreen",
      "attachment_url": "https://www.handyworks.com/wp-content/uploads/2017/11/PrintScreen.png",
      "post_date": "2017-11-08 16:21:23"
    },
    {
      "title": "POS",
      "post_name": "pos",
      "attachment_url": "https://www.handyworks.com/wp-content/uploads/2017/11/POS.jpg",
      "post_date": "2017-11-30 16:57:26"
    },
    {
      "title": "upgradeNag",
      "post_name": "upgradenag",
      "attachment_url": "https://www.handyworks.com/wp-content/uploads/2018/01/upgradeNag.jpg",
      "post_date": "2018-01-12 16:05:51"
    },
    {
      "title": "oneDisk",
      "post_name": "onedisk",
      "attachment_url": "https://www.handyworks.com/wp-content/uploads/2018/01/oneDisk.png",
      "post_date": "2018-01-18 15:06:01"
    },
    {
      "title": "Inventory",
      "post_name": "inventory",
      "attachment_url": "https://www.handyworks.com/wp-content/uploads/2018/02/Inventory.jpg",
      "post_date": "2018-02-07 20:35:47"
    },
    {
      "title": "goodbye",
      "post_name": "goodbye",
      "attachment_url": "https://www.handyworks.com/wp-content/uploads/2018/04/goodbye.jpg",
      "post_date": "2018-04-23 14:15:26"
    },
    {
      "title": "resize",
      "post_name": "resize",
      "attachment_url": "https://www.handyworks.com/wp-content/uploads/2018/05/resize.png",
      "post_date": "2018-05-07 20:38:02"
    },
    {
      "title": "transform",
      "post_name": "transform",
      "attachment_url": "https://www.handyworks.com/wp-content/uploads/2018/08/transform.png",
      "post_date": "2018-08-15 17:11:31"
    },
    {
      "title": "procCodeXform",
      "post_name": "proccodexform",
      "attachment_url": "https://www.handyworks.com/wp-content/uploads/2018/09/procCodeXform.png",
      "post_date": "2018-09-10 16:39:51"
    },
    {
      "title": "Buffy",
      "post_name": "buffy",
      "attachment_url": "https://www.handyworks.com/wp-content/uploads/2019/02/Buffy.jpg",
      "post_date": "2019-02-21 19:53:05"
    },
    {
      "title": "addins",
      "post_name": "addins",
      "attachment_url": "https://www.handyworks.com/wp-content/uploads/2019/04/addins.png",
      "post_date": "2019-04-17 13:08:15"
    },
    {
      "title": "woocommerce-placeholder",
      "post_name": "woocommerce-placeholder",
      "attachment_url": "https://www.handyworks.com/wp-content/uploads/woocommerce-placeholder.png",
      "post_date": "2019-04-22 16:05:53"
    },
    {
      "title": "ADD-IN",
      "post_name": "add-in",
      "attachment_url": "https://www.handyworks.com/wp-content/uploads/2020/01/ADD-IN.png",
      "post_date": "2020-01-28 19:05:15"
    },
    {
      "title": "image",
      "post_name": "image",
      "attachment_url": "https://www.handyworks.com/wp-content/uploads/2024/08/image.png",
      "post_date": "2024-08-08 17:53:38"
    },
    {
      "title": "image",
      "post_name": "image-3",
      "attachment_url": "https://www.handyworks.com/wp-content/uploads/2024/08/image-1.png",
      "post_date": "2024-08-08 17:56:23"
    }
  ],
  "categories": {
    "Update Blog": [
      "Update 2/12/2016",
      "Update 1/15/2016",
      "Update 12/10/2015",
      "Update 11/11/2015",
      "Welcome to the new HandyWorks website!",
      "Update 12/9/2016",
      "Update 9/12/2016",
      "Update 7/1/2016",
      "Update 5/16/2016",
      "Update 4/19/2016",
      "Multi-clinic electronic billing 1/27/2017",
      "New streamlined website 1/27/2017",
      "2/13/2017 Update",
      "My transaction screen doesn't show case totals.",
      "Unpaid Bills revisited",
      "Inspired by the Ocars...",
      "How can I remove all my old (inactive) patients at once?",
      "Electronic Remittance (835) Fix",
      "New Statistics module",
      "Statistical analysis",
      "How to fix duplicate patients, plus more",
      "Duplicates merge perfected. Plus more.",
      "Database repair option",
      "Scrollbar issue in Office 365",
      "Margin Settings Upgrade",
      "Medicare date format changes to two digit years",
      "Cleanup version",
      "Patient Data Print-Screen, New POS",
      "Upgrade Nag, Letters Fix",
      "Remember When?",
      "Inventory Control",
      "April Update",
      "Goodbye 800#",
      "Screen Resizing",
      "Enhanced Connectivity Tests",
      "Transform multiple carriers and procedure codes",
      "Adding 98943 to the exam form",
      "New for 2019",
      "That's Been Fixed!",
      "NY Workers Comp",
      "New Add-In menu",
      "Improved Receipt and New Credit Card Processor",
      "Support for multiple databases",
      "2020 Add-In menu, ordering physician",
      "A Raw Data Checkup",
      "Update to Added Appointments",
      "Multiple Appointment Fix",
      "2021 Welcome Update",
      "2021 Midyear update",
      "Tax Rate Fix",
      "A new Report and Appointment Book fixes",
      "Minor improvements Summer 2022",
      "A longer Payer ID - Fall 2022 update",
      "Month at a glance - Jan 2023",
      "Faster & Faster",
      "Small Electronic Billing Edits",
      "Corrected Claims",
      "Enhanced Daily Appointment Reports",
      "Integrated Text Messaging",
      "New and Fixed in February 2025"
    ],
    "Support": [
      "Who Owes?"
    ]
  }
}